Objektnummer;Vermarktungsart;Straße;Hausnummer;PLZ;Ort;Land;Kaufpreis;Grundstücksgröße;Wohnfläche;Objekttitel
SHI001;Miete;Schadowstraße;11;40212;Düsseldorf;Deutschland;0;0;0;Im Herzen von Ellerau, gut geschnittenes Büro mit Aufzug!
SHI002;Miete;Schadowstraße;22;40212;Düsseldorf;Deutschland;0;0;0;Top Lage, moderne Büro-/Praxisräume mit hervorragender Frequenz!
SHI003;Miete;Schadowstraße;33;40212;Düsseldorf;Deutschland;0;0;0;Büroräume mit großer Ausstellungsfläche in bester Sichtlage, individuelle Aufteilung möglich!
SHI004;Kauf;Schadowstraße;44;40212;Düsseldorf;Deutschland;298000;800;180;Jugendstilvilla mit großzügiger Raumaufteilung und Mieteinnahmen aus vier separaten Appartements!
SHI005;Kauf;Schadowstraße;20 - App. 133;40212;Düsseldorf;Deutschland;0;0;0;
